### ISSUE TITLE
Client always gets LowID when it's on the same network/public IP as the server (hairpin NAT)

### ISSUE THREAD

**Issue by Linderkin** [andrey23127/ed2k-server#11]
I'm running my own ed2k-server and also sharing files from an eMule client on a box in the same network (same public IP, reaching the server through my router's hairpin NAT since it's the same IP as the server's this_ip). Spent a while thinking it was a port-forwarding problem on my end (Mikrotik RB5009) before narrowing it down to the server side.

What's happening: my client always gets LowID, and other peers who ask the server for sources on files I share get back a private IP that's obviously useless from outside my LAN. Turned on debug logging and found this on login:

INFO client logged in ip=192.168.30.254 nick=Linderkin id=157 high_id=false country=?? software=eMule flags="0x0319"

That 192.168.30.254 is my router's internal hairpin address, not my public IP. Checked the full debug log across several reconnects and there's no HighID probe line at all for my login — it just silently assigns LowID. Meanwhile other (external) clients show normal HighID probe timeout/succeeded/refused lines.

My ports are forwarded correctly and reachable from outside — confirmed with eMule's own port test, and I can see established TCP connections from real external IPs on 63500 in the router. So this isn't a firewall/NAT config issue, it's specifically the case where the login socket's source IP is a private range because client and server share the same public IP.

Guessing the fix would be something like: if the login socket IP is private/RFC1918, fall back to probing this_ip (the server's own configured public IP) instead of the private address, and use that for source lookups too — since in that topology the client's real public IP is by definition the same as the server's.

Not a huge deal for most setups I imagine, but probably worth handling since self-hosting both client and server on the same box/network seems like a fairly normal thing to do.

**Comment by andrey23127** [comment]
Hello.
Thank you for reporting the bug. I have created a fixed version: https://files.emule-security.org/ed2k-server
You need to add the following section to the server settings:
--------------------------------
[network]
hairpin_lan_clients = true
--------------------------------
and ensure that `server.this_ip` is set to the actual public IP address.
If successful, the server log will show the entry: `hairpin: client verified behind our own NAT → HighID`
If there are issues with the port forwarding configuration on the Mikrotik router, the log will show: `port answers but with a different user hash`
The server file size is larger than before because some pre-release options have been added, such as the ability to update filters via the server's web interface.

**Comment by Linderkin** [comment]
Thanks, that fixed the "hairpin_lan_clients" detection at least partially - the server now recognizes the login coming from a private IP and attempts the verification probe (I can see the hairpin: ... reason="peer closed before answering" line), so the setting is working as far as triggering the check goes. But the probe itself still isn't succeeding, and I think I've narrowed down where.

I checked the connection on my router (Mikrotik) for the probe attempt, and it's not a simple rejection - there's an actual TCP handshake and a real data exchange before the close:

tcp  192.168.30.102:xxxxx -> <public_ip>:63500  tcp-state=close  timeout=9s
orig-packets=3  repl-packets=2  orig-bytes=203  repl-bytes=100

So my eMule client does accept the connection and sends back 100 bytes of data - it's not silently dropping it or resetting. I also made sure eMule isn't filtering private-range IPs (double-checked the "don't filter private IPs" security option is on and restarted the client), and that didn't change anything - same "peer closed before answering" result.

So it looks like the client is responding with something, but the server isn't recognizing that response as a valid answer for the hairpin verification and closing the connection anyway (or the client closes after sending that response and the server doesn't get to read/parse it as expected).

Is there a specific handshake/payload the hairpin probe expects back from the client before it'll mark it verified? Wondering if this is a timing issue (client closes before the server reads the reply) or if the probe is expecting a different response format than what a stock eMule client sends back on an unsolicited incoming connection to its TCP listen port.

Happy to run further tests. Left RUST_LOG=debug on if you want me to grab a specific reproduction.

**Comment by andrey23127** [comment]
Thanks for the test and the router log entry. I’ve made changes to `highid_probe`; that should help. If the HighID connection doesn't go through, we'll need to capture a `tcpdump` on the client machine during login
tcpdump -i any -n 'tcp port 63500' -X
And check the line reason= in the server debug log when the connection is rejected.
The link to the updated file is the same - https://files.emule-security.org/ed2k-server

**Comment by Linderkin** [comment]
Tried the new build. The hairpin detection still doesn't complete - same reason="peer closed before answering" result. But I ran a packet capture on the client machine during login this time, filtered specifically on the server's public IP (used Windows' pktmon since I'm not on Linux client-side, same idea as tcpdump -X), and found something that might narrow it down further.

There's zero traffic at all on port 63500 to/from the server IP during the login - not a SYN, not anything. Client-side capture is clean for that port for the whole session window, confirmed against the server's clock (correlated timestamps, capture covers the exact second of the login).

What stood out: on the server log, the hairpin: ... reason="peer closed before answering" line and the client logged in line are only ~125 microseconds apart:

17:21:14.516958Z DEBUG hairpin: no verified answer → LowID lan_ip=<private_ip> public_ip=<public_ip> port=63500 reason="peer closed before answering"
17:21:14.517083Z  INFO client logged in ip=<private_ip> ... high_id=false ...

That's way too fast for an actual TCP connection attempt + wait for response, even locally. Before this update, when I captured the equivalent moment on my router's connection tracker, I saw a real handshake with actual data exchanged (3 packets out, 2 back, ~100 bytes, closed after ~9s) - so previously it was at least attempting and getting a real reply. Now there's no attempt visible on the wire at all, and the timing looks like it's failing near-instantly rather than actually opening a socket and waiting on it.

So my guess is the new hairpin verification code might be short-circuiting before it actually sends anything - maybe an early return/exception on the private-IP branch, rather than the probe genuinely reaching out and getting rejected. Let me know if you want the full capture file or want me to test with obfuscation disabled / different eMule settings to rule those out.

**Comment by andrey23127** [comment]
I updated the server again, adding the reason for the unsuccessful connection to the server log. 
Before the next test, one correction and one request.

**The 125 µs is not the probe's duration.** That interval is between the line
that *reports* the probe result and the line that finishes the login. The probe
had already completed before the first of those was written; how long it actually
ran is not in the log at all. So the "fails near-instantly without opening a
socket" reading doesn't follow from those two timestamps — sorry, that's on the
logging, which gave you nothing to go on.

**What your capture does tell us.** `peer closed before answering` can only be
reached *after* a successful TCP connect: the socket was established, and then
the first read returned end-of-file. If your client machine sees no SYN at all on
63500, then something between the server and the client accepted that connection.
The most likely candidate is the router itself — a connection from the LAN to the
router's own WAN address is handled by the router's stack unless there is an
explicit hairpin/NAT-loopback rule for that port, in which case it never reaches
the dst-nat rule that would forward it to your eMule.

I've added per-stage instrumentation to the probe for this build. Please run with
`RUST_LOG=debug` and grab the lines beginning `probe_identity:` — they now carry
the target address, the local and peer socket addresses, elapsed microseconds at
each stage, how many bytes were written, how many were read, and the first bytes
of any answer. Between them they should settle this without guesswork.

---

### Three things to send back, in order of how cheap they are

**1. One command on the SERVER — this alone may answer it**

```
timeout 5 nc -v <your_public_ip> 63500 < /dev/null; echo "exit=$?"
```

* `Connected` then an immediate close with no data → the router accepted it; the
  connection never reaches eMule. That is a Mikrotik hairpin/NAT-loopback
  question, not a server one.
* `Connection timed out` → packets leave but the dst-nat rule isn't matching.
* `Connected` and it hangs → it does reach eMule, and the problem is in the
  handshake, which is our side.

For contrast, the same thing straight to the LAN address:

```
timeout 5 nc -v 192.168.30.102 63500 < /dev/null; echo "exit=$?"
```

**2. What is in `server.this_ip`?**

The probe connects to exactly that address. If it holds anything other than your
real public IP — the router's address, the server's own LAN address, an old value
— then everything you've observed follows from that with no networking mystery
required. Worth confirming before anything else.

**3. A capture on the SERVER, not the client**

The packets we're missing aren't on the client machine: our connect *originates
on the server*, and it died somewhere between the two. So the capture has to be
taken where it starts.

```
sudo timeout 30 tcpdump -i any -n -s0 'tcp port 63500' -w /tmp/hairpin.pcap
```

Log the client in while that runs, then:

```
tcpdump -r /tmp/hairpin.pcap -n -tt
```

The decisive detail is **which address the SYN-ACK comes from**:

* from the public IP → the router's own stack answered, and the forward was never
  consulted;
* from `192.168.30.102` → dst-nat did fire, but the return path is asymmetric
  (the client replies directly to the server across the LAN, bypassing the
  router, so the server sees a reply from an address it never sent to and drops
  it). That is the textbook incomplete-hairpin case and is fixed with a masquerade
  rule on the router, not in the server.

No need for the pktmon file — you've already extracted the only thing it holds,
which is that nothing arrives on 63500. Converting `.etl` to something readable
would cost you time and tell us nothing further.

---

### One thing that was genuinely our bug, now fixed

Your earlier router-table numbers (3 packets out, 2 back, ~100 bytes, no payload
in the reply) were what identified it. The probe was sending the client *its own
user hash* as the sender's identity. eMule reads that as a connection looping back
to itself and closes without replying — which is exactly the shape those counters
described. The probe now presents a distinct identity derived from the server's
seckey.

That fix is in the build you tested, so if the connection is still dying before
any payload is exchanged, the remaining problem is upstream of eMule — which is
what your capture already suggests.

**Comment by Linderkin** [comment]
Went through your three asks, in order.

**1. `nc` test** - did both, but heads up: `nc ... < /dev/null` closes the connection itself right after connecting (empty stdin = immediate FIN), so it can't actually distinguish your three cases - it reported "open" both times regardless of what was on the other end. Not useful diagnostically as run; happy to redo with a different tool if you still want that specific test, but the tcpdump below already answers the question a different way.

**2. `this_ip`** - confirmed correct in config.toml, matches my real public IP, no stale/wrong value.

**3. tcpdump on the server** - did this twice (once accidentally with the same capture reused, then a clean one). Here's the real one, server-side, during an actual eMule login:

```
Out 192.168.30.102.44738 > <public_ip>.63500: Flags [S]
In  <public_ip>.63500 > 192.168.30.102.44738: Flags [S.]
Out 192.168.30.102.44738 > <public_ip>.63500: Flags [.]
Out 192.168.30.102.44738 > <public_ip>.63500: Flags [P.] length 39
In  <public_ip>.63500 > 192.168.30.102.44738: Flags [R.]
```

On the "which address answers" question - it comes back from the public IP, but I don't think that means the router's own stack answered without ever reaching eMule. I checked the router's connection tracker for this exact connection and the flags were `SACsd` - the `d` there means dst-nat fired (destination was translated to my actual client), and the `s` means srcnat/masquerade fired on the reply (that's why it looks like it's coming from the public IP - that's my own masquerade rule doing its job, not the router intercepting). So the packet did leave the router's forward path and hit my actual eMule client, got a real reply, and 39 bytes of payload were exchanged before the RST. Given that plus the earlier "sent client its own hash" bug you already found and fixed, I think the connection is reaching eMule fine - the question is more what's happening after that 39-byte send now.

**Extra thing I noticed that wasn't part of your 3 asks**, but seems relevant: `probe_identity:` never shows up in the debug log at all, across multiple real logins. But I did spot this line, ~5ms *before* the `hairpin: ... reason="peer closed before answering"` line, for the same login event:

```
DEBUG private IP → LowID without probe ip=<private_ip>
DEBUG hairpin: no verified answer → LowID lan_ip=<private_ip> public_ip=<public_ip> port=63500 reason="peer closed before answering"
```

Both lines fire for the same connection, 5ms apart. Looks like there might be two separate code paths handling the same private-IP login - one that immediately decides "private IP, skip probing, LowID" and a second, separate hairpin verification that runs anyway afterward and reports its own (different) failure reason. Not sure if that's intentional (e.g. an old code path that should've been removed when hairpin support was added) or if it explains why `probe_identity:` never appears - maybe that instrumentation is only in the code path that isn't the one actually running for this case.

Let me know what capture/log you want next.

**Comment by andrey23127** [comment]
The problem is most likely server-side obfuscation. Run another test on the server version with extended debug information in highid_probe - https://files.emule-security.org/ed2k-server

**The `nc` test was my mistake.** `< /dev/null` closes stdin immediately, so nc
sends FIN as soon as it connects and every outcome looks like "open". You're
right that it can't distinguish the three cases. Drop it — your tcpdump answered
the question properly anyway, and it's better evidence than nc would have been.

**You're running the previous build.** The string `peer closed before answering`
does not exist in the instrumented version — I replaced it with
`peer closed without sending a byte` and `peer closed mid-answer`, precisely so
that "closed with nothing" and "closed mid-reply" could be told apart. Seeing the
old wording means the binary predates that change, which also explains why no
`probe_identity:` lines appear: that instrumentation is in the same commit.

Worth rebuilding before the next round — the questions we're now down to are
exactly the ones those lines answer.

**The two log lines are one code path, not two.** Both are expected and neither is
leftover:

* `private IP → LowID without probe` comes from the *plain* probe, which refuses
  to try an RFC1918 address. That is the original behaviour and is correct: for a
  private address there is nothing useful to connect to.
* the hairpin fallback then runs, and it is a *separate, later* attempt against
  `this_ip` rather than the private address. It logs its own outcome.

The fallback deliberately runs only after the plain probe has already said LowID,
so it can add a HighID but never take one away. The 5 ms between them is the
fallback doing its work. I should have made the first line say "skipping plain
probe" rather than "→ LowID", since it isn't the final verdict — that wording sent
you looking for a second code path that isn't there.

---

### What your tcpdump actually shows, and why it's good news

```
Out 192.168.30.102.44738 > <public_ip>.63500: Flags [S]
In  <public_ip>.63500 > 192.168.30.102.44738: Flags [S.]
Out ...: Flags [.]
Out ...: Flags [P.] length 39
In  ...: Flags [R.]
```

That 39-byte payload is exactly our HELLO, and the arithmetic confirms it end to
end: `0xE3` + 4-byte length + opcode + body, where the body is the hash-size byte,
16-byte user hash, 4-byte client ID, 2-byte TCP port, 4-byte tag count, 4-byte
server IP and 2-byte server port — 33 bytes of body, 39 on the wire. So the frame
is being built and delivered, and your reading of the conntrack flags (`d` =
dst-nat fired, `s` = masquerade on the reply) matches: it reaches eMule.

Which moves the question to the last packet. The reply is **RST, not a graceful
close** — eMule is actively refusing the connection after reading our hello, not
timing out or hanging up politely. That is a decision on its side, and it narrows
the candidates a lot.

---

### Next round

**1. Rebuild and capture the `probe_identity:` lines.** With `RUST_LOG=debug` they
now give: target address, local and peer socket addresses, microseconds to
connect, bytes written, bytes read, and the first bytes of any answer. If the RST
still arrives, the line will read `peer closed without sending a byte` with
`bytes_read=0`, and we will know it is a refusal rather than a parse problem on
our side.

**2. Protocol obfuscation — you offered this earlier and now it's worth doing.**
In eMule, Options → Security → Protocol obfuscation. If "Require obfuscated
connections" is enabled, a plain-text hello on the listen port is dropped, and a
reset right after the first payload packet is exactly what that looks like. Please
try one login with it set to "Enable" (not "Require"), or off entirely.

If that turns out to be it, the fix is ours rather than yours — the probe would
need to speak the obfuscated handshake, and a server that supports obfuscated
client connections has no business assuming a client will accept plain text.
Knowing either way decides whether this feature can work at all in your setup.

**3. eMule version and fork**, if it isn't stock 0.72a. The hello handling differs
enough between forks to matter here.

No further captures needed beyond that — between the debug lines and the
obfuscation test we should have it.

---

### For the record

The hello now carries an identity derived from the server's seckey rather than
the client's own user hash. That earlier bug was found from your router counters
(3 packets out, 2 back, zero payload in the reply) — without those numbers I would
have gone on looking at the read path instead of what we were sending.

**Comment by Linderkin** [comment]
Rebuilt and got the new probe_identity lines. Also double-checked obfuscation settings first since you asked - it was already set to "Enable" (checked) without "Require" (unchecked), so that's not it, at least not as configured.

Here's what the new debug lines show for two separate real login attempts:

```
probe_identity: connected addr=<public_ip>:63500 local=192.168.30.102:40956 peer=<public_ip>:63500 connect_us=595
probe_identity: read failed addr=<public_ip>:63500 bytes_read=0 error=Connection reset by peer (os error 104)

probe_identity: connected addr=<public_ip>:63500 local=192.168.30.102:48488 peer=<public_ip>:63500 connect_us=545
probe_identity: read failed addr=<public_ip>:63500 bytes_read=0 error=Connection reset by peer (os error 104)

```

So: connects fine (under 1ms), sends the hello, then bytes_read=0 with a hard reset both times - consistent across two separate attempts. Not a hang, not a partial read.

eMule version: eMule AI 1.6.1 x64 - so not stock 0.72a, it's the "eMule AI" fork/mod. No idea offhand how different its hello/handshake parsing is from stock, but flagging since you said forks might matter here.

Let me know what else you want to see.

One more data point after that: I fully closed and reopened eMule (not just reconnected to the server) and tried again. This time the failure mode changed slightly:
```
probe_identity: connected addr=<public_ip>:63500 local=192.168.30.102:52008 peer=<public_ip>:63500 connect_us=555
probe_identity: peer closed addr=<public_ip>:63500 bytes_read=0 hello_bytes=39 elapsed_us=1254 first=[]
```
No more Connection reset by peer this time - it's a clean "peer closed" now, still bytes_read=0, still nothing in first. So after a full client restart it went from an active RST to a graceful close with no data. Not sure if that's meaningful or just noise from it being the very first incoming connection after eMule's own startup, but flagging since you specifically separated those two cases in this build.

**Comment by andrey23127** [comment]
[probe_test.py](https://github.com/user-attachments/files/31347128/probe_test.py)
That's a clean result, thanks — and it rules out the two things I was most
suspicious of. Obfuscation is not "Require", and the reset is immediate and
reproducible with `bytes_read=0` both times, so this is not a timing or partial
read problem. eMule reads our 39-byte hello and refuses it.

`connect_us=595` is also informative: sub-millisecond, which is what a LAN round
trip through the router looks like, so the connect really is going out and coming
back through the NAT rather than being answered locally.

So the remaining question is narrow: **what about our hello does eMule AI 1.6.1
object to?** Rather than guess at fork differences, here is a script that tries
several variants and prints exactly what comes back. It touches nothing on the
server — it opens a socket, writes, reads, exits.

Save it as `probe_test.py` and run it **on the server**, twice:

```
python3 probe_test.py <public_ip> 63500        # the path the server uses
python3 probe_test.py 192.168.30.102 63500     # straight to the client, no NAT
```

The second one is the important control. If the LAN address answers and the public
one resets, the handshake is fine and the problem is in the NAT path. If both
reset identically, it is the handshake and one of the variants should show which
part.

### The four variants, and what each would tell us

1. **No tags** — exactly what the server sends today. Expected to reset if the
   fork requires the standard tag set.
2. **With CT_NAME / CT_VERSION / CT_PORT** — what a real client always includes.
   If this is answered and (1) is not, our hello is simply too bare and the fix is
   one small change on our side.
3. **With tags, claiming a LowID instead of a HighID.** Some clients check a
   claimed HighID against the address the connection arrived from, and object when
   a NAT has rewritten it — which is precisely the situation on a hairpin path,
   since your router masquerades the source. If this one is answered and (2) is
   not, that is the cause, and it is also fixable on our side.
4. **Connect and stay silent** — does the peer speak first, or close on its own?
   Distinguishes "rejected our packet" from "rejects unknown inbound connections
   generally".

Paste the whole output of both runs. Between the two targets and the four
variants that should be conclusive; if one variant gets an OP_HELLOANSWER back,
we have our answer and the change is a few lines.

### One thing worth checking in the client while you're there

eMule AI, like most forks, has some form of "reject connections from unknown
clients" or a connection-limit behaviour that resets rather than queues. If
variant 4 also resets — that is, it refuses even a silent connection — then the
client is rejecting the inbound connection itself and no hello we send will ever
be accepted, and this feature cannot work in that configuration. That would be
worth knowing before either of us spends more on it. For an experiment, you can try the official version of eMule - https://github.com/irwir/eMule/releases/tag/eMule_v0.72a-community

**Comment by Linderkin** [comment]
Ran both probe_test.py variants, then also tried a real login with stock eMule as you suggested. Two separate findings here - pasting in order.

**1. eMule AI, both targets, all 4 variants of probe_test.py**

Against the client's LAN address (192.168.10.2:63500), no NAT involved:
```
target 192.168.10.2:63500
=== variant 1 — no tags
    sending 39 bytes: ...
    READ FAILED: [Errno 104] Connection reset by peer
=== variant 2 — with CT_NAME / CT_VERSION / CT_PORT
    sending 72 bytes: ...
    READ FAILED: [Errno 104] Connection reset by peer
=== variant 3 — with tags, claiming a LowID
    sending 72 bytes: ...
    READ FAILED: [Errno 104] Connection reset by peer
=== variant 4 — connect and stay silent
    peer closed without sending anything
```

Against the public IP (same path the server actually uses):
```
target <public_ip>:63500
=== variant 1 — no tags
    READ FAILED: [Errno 104] Connection reset by peer
=== variant 2 — with CT_NAME / CT_VERSION / CT_PORT
    READ FAILED: [Errno 104] Connection reset by peer
=== variant 3 — with tags, claiming a LowID
    READ FAILED: [Errno 104] Connection reset by peer
=== variant 4 — connect and stay silent
    peer closed without sending anything
```

Identical result on both targets, all four variants. NAT path isn't the differentiator - LAN-direct behaves exactly the same as through the router. Variant 4 also fails (closes without sending or reading anything), so per what you flagged earlier, this looked like eMule AI rejecting the inbound connection itself regardless of content.

**2. Same script against stock eMule 0.72a-community - full raw output this time**

Against LAN (192.168.10.2:63500):
```
target 192.168.10.2:63500, our user hash 85de981ad70ea89ac7ba50a76c4f6fa3
=== variant 1 — no tags (what the server sends today)
    sending 39 bytes: e322000000011085de981ad70ea89ac7ba50a76c4f6fa37f000001361200000000000000000000...
    GOT 175 bytes: c53f0000000172010700000003010020010000000301002204000000030100213ef8000003010023030000000301002401000000030100250200000003010027...
    not an eD2k frame
=== variant 2 — with CT_NAME / CT_VERSION / CT_PORT
    sending 72 bytes: e343000000011085de981ad70ea89ac7ba50a76c4f6fa37f000001361203000000820111006564326b2d736572766572...
    GOT 175 bytes: c53f0000000172010700000003010020010000000301002204000000030100213ef8000003010023030000000301002401000000030100250200000003010027...
    not an eD2k frame
=== variant 3 — with tags, claiming a LowID
    sending 72 bytes: e343000000011085de981ad70ea89ac7ba50a76c4f6fa323010000361203000000820111006564326b2d736572766572...
    GOT 175 bytes: c53f0000000172010700000003010020010000000301002204000000030100213ef8000003010023030000000301002401000000030100250200000003010027...
    not an eD2k frame
=== variant 4 — connect and stay silent
    TimeoutError: timed out
```

Against the public IP (<public_ip>:63500):
```
target <public_ip>, our user hash c2fe38f3870e036ced7f4c46a1bc6f8a
=== variant 1 — no tags (what the server sends today)
    sending 39 bytes: e3220000000110c2fe38f3870e036ced7f4c46a1bc6f8a7f000001361200000000000000000000...
    GOT 175 bytes: c53f0000000172010700000003010020010000000301002204000000030100213ef8000003010023030000000301002401000000030100250200000003010027...
    not an eD2k frame
=== variant 2 — with CT_NAME / CT_VERSION / CT_PORT
    sending 72 bytes: e3430000000110c2fe38f3870e036ced7f4c46a1bc6f8a7f000001361203000000820111006564326b2d736572766572...
    GOT 175 bytes: c53f0000000172010700000003010020010000000301002204000000030100213ef8000003010023030000000301002401000000030100250200000003010027...
    not an eD2k frame
=== variant 3 — with tags, claiming a LowID
    sending 72 bytes: e3430000000110c2fe38f3870e036ced7f4c46a1bc6f8a23010000361203000000820111006564326b2d736572766572...
    GOT 175 bytes: c53f0000000172010700000003010020010000000301002204000000030100213ef8000003010023030000000301002401000000030100250200000003010027...
    not an eD2k frame
=== variant 4 — connect and stay silent
    TimeoutError: timed out
```

Same 175-byte reply (starts 0xc5 3f 00 00 00 01 72...) on both targets, all three content variants - looks like a real, consistent answer, just not decoded as one since the script only checks for the plain 0xE3 marker. Variant 4 timed out instead of closing, so stock eMule waits for real data rather than rejecting blind connections.

**3. Real login against the server with stock eMule running**

```
DEBUG probe_identity: connected addr=<public_ip>:63500 ... connect_us=482
DEBUG probe_identity: answer header addr=<public_ip>:63500 header=[197, 63, 0, 0, 0, 1] elapsed_us=15884
DEBUG hairpin: no verified answer → LowID lan_ip=<private_ip> public_ip=<public_ip> port=63500 reason="not an eD2k answer"
```
197 = 0xC5, matches the byte 0 of the 175-byte reply above. The probe reads the full header fine (normal round-trip time), then rejects it as "not an eD2k answer".

So it looks like two separate things: eMule AI rejects unsolicited inbound connections outright regardless of content (possibly a connection-filtering feature specific to that fork), while stock eMule answers correctly but gets rejected by the probe itself for using compression instead of plain protocol. The second one looks like it's on your end and probably explains most real-world cases, since compression is common among eMule clients generally, not just this fork.

**Comment by andrey23127** [comment]
I made changes based on the data from your test - https://files.emule-security.org/ed2k-server

Your control run with stock eMule is what cracked this. One correction to the
diagnosis, then what changed on our side, then one thing to check on yours.

## It isn't compression

`0xC5` is `OP_EMULEPROT`, eMule's **extended protocol** marker. Compressed payloads
carry `0xD4` (`OP_PACKEDPROT`). Nothing in that reply was compressed, and nothing
needed decompressing.

Decoding your 175 bytes:

```
c5 3f000000 01 72 01 07000000 03 0100 20 01000000 ...
│  └ len=63 │  │  │  └ 7 tags   └ tag 0x20 (ET_COMPRESSION) = 1
│           │  │  └ protocol version 1
│           │  └ client version 0x72
│           └ opcode 0x01 = OP_EMULEINFO
└ 0xC5 = eMule extended protocol
```

That frame is 1 + 4 + 63 = **68 bytes** on the wire. 175 − 68 = **107** — and those
107 bytes are the `0xE3` `OP_HELLOANSWER` we were waiting for, which had already
arrived in the same read.

So eMule answers an incoming HELLO with **two frames back to back**: its own
OP_EMULEINFO first, then the eDonkey HELLOANSWER. The `ET_COMPRESSION = 1` tag
inside the first one only advertises that the client *supports* compression — it
says nothing about how this particular reply is encoded.

The bug was that the probe read six bytes, judged the protocol byte of the first
frame, and threw the whole answer away. Squarely ours.

## What changed

**1. The probe reads frames, not a fixed header.** It now walks the stream frame
by frame and skips anything that is not a hello, using each frame's declared
length — which is in the clear in every eD2k protocol variant, including the
compressed one, so no decompression is involved anywhere. It stops at the first
`OP_HELLOANSWER` (or `OP_HELLO`, which some clients send instead) and compares the
user hash. Bounded at 8 frames and 64 KB of preamble so a peer cannot hold it
reading indefinitely. Every frame is logged with its protocol byte, length and
opcode.

**2. The hello can now be obfuscated.** We compared against Lugdunum's
implementation, and its probe sends an *obfuscated* hello whenever the client
advertised crypt support at login — keys derived as
`MD5(client user hash ‖ 34 ‖ random key part)` for sending and `‖ 203 ‖` for
receiving, RC4 with the first 1024 bytes discarded. Ours only ever spoke plain,
so a client configured to require obfuscation was unreachable by the probe on
principle. It now does the same handshake, with a single fallback to plain if the
obfuscated attempt is refused — "supports" is not "requires", and a client may
have advertised the capability with the crypt layer switched off.

Incidentally, that also confirmed our overall approach: Lugdunum's
`handle_hello_request` requires opcode `0x4C` and compares the 16-byte user hash
against the one from login, exactly as we do. The hello/answer/compare design was
right; the reader around it was not.

## What to check on your side, for the eMule AI case

Its behaviour is different in kind: it resets connections on which we send
**nothing at all**, so no change to what we send can affect it. That decision is
made at accept time, before a byte is read, and in the source it comes from the
IP filter and ban checks in `AcceptConnectionCond` — `CF_REJECT` there produces
exactly the reset you see.

Three things, and the order matters because they are separate settings that are
easy to confuse:

1. **Options → Security → "Don't filter private IPs"** — make sure this is
   **checked**. This is the one that governs whether a private source address is
   exempted from the filter. It is *not* the same setting as "Filter server and
   client LAN IPs", which lives elsewhere and only affects address handling inside
   the protocol, not whether a connection is accepted.

2. **The advanced/tweaks page** — check anything there relating to LAN or private
   address filtering as well; the two pages have overlapping-sounding options and
   only one of them is on the accept path.

3. **Remove the IP filter file entirely, temporarily.** This is the important one.
   In eMule AI, `IsFiltered` checks only whether the loaded list is empty — there
   is no check of whether the filter is switched *on*. So disabling the filter in
   the UI does not necessarily stop it filtering: as long as the ranges are still
   loaded in memory, they still apply. And a standard `guarding.p2p` contains the
   RFC1918 ranges, which is precisely what our probe's source address falls into.
   Move `ipfilter.dat` / `guarding.p2p` out of the config directory and restart
   the client.

While testing, turn on **"Log filtered IPs"** on the same Security page. If the
filter is the cause you will see a line naming the address, and that settles it
one way or the other.

**Comment by Linderkin** [comment]
Rebuilt with the new probe and tested with stock eMule 0.72a-community first:

```
DEBUG private IP → skipping plain probe (hairpin fallback may still run) ip=<private_ip>
DEBUG probe_identity: connected addr=<public_ip>:63500 ... 
DEBUG probe_identity: sent obfuscated handshake addr=<public_ip>:63500
DEBUG hairpin: obfuscated probe refused, retrying in the clear public_ip=<public_ip> port=63500
DEBUG probe_identity: connected addr=<public_ip>:63500 ...
DEBUG probe_identity: frame addr=<public_ip>:63500 proto=0xC5 len=63 opcode=0x01 elapsed_us=8111
DEBUG probe_identity: frame addr=<public_ip>:63500 proto=0xE3 len=102 opcode=0x4C elapsed_us=8153
 INFO hairpin: client verified behind our own NAT → HighID lan_ip=<private_ip> public_ip=<public_ip> port=63500
```

HighID, verified, working end to end. So the frame-walking fix is solid - confirmed with a real client, real hairpin NAT, real obfuscated-then-plain fallback. Good to close the loop on that part.

Below is everything I went through trying to get eMule AI working too, for the record, but given the above I'd treat this as a nice-to-have rather than something worth more of your time:

---

Went through all three things you flagged. Results:

1. "Don't filter private IPs" - already checked.
2. The separate LAN-filtering option ("Filter server and client LAN IPs" on the advanced/tweaks page) - already unchecked, confirmed.
3. Removed ipfilter.dat entirely from the config folder, fully restarted the client (not just reconnect) - no change, still reset.

Then tried "Log filtered IPs". This client doesn't have that exact toggle under Security - closest equivalent is on the advanced options page: "Log filtered/ignored IPs", already enabled. Turned on "save log to disk" too and reconnected. Nothing showed up about filtering, ignoring, or rejecting any address - just the normal login sequence.

Also went through the client's own "protection panel" (583 rule definitions - anti-P2P bot detection, aggressive client detection, non-SUI client punishment, etc.) and disabled several of the most plausible ones one at a time (community detection, aggressive client detection, bad-packet-sender detection, the whole non-SUI punishment block) - no change in any case, immediate reset with bytes_read=0 every time.

Couldn't find what's actually closing the connection. eMule AI isn't a widely-documented fork so I don't have much more to go on beyond the UI. Given stock eMule now works cleanly through the same server/NAT path, my setup is sorted - happy to poke at eMule AI more if you're curious, but no pressure from my end.

**Comment by andrey23127** [comment]
<img width="645" height="579" alt="Image" src="https://github.com/user-attachments/assets/3a765667-655b-458f-ab27-9555c75aeb6e" />
You can try enabling in eMule AI in the extended settings verbose log section with the settings as in the screenshot.
And when connecting to the server, look at the entries in the verbose log and the protection log.
In the connection settings, disable the options randomize listen port at startup.
In the eMule AI settings, under the network interface section, try selecting any interface first, and then try with the specific network interface you selected. Disable IP Guard and VPN Guard.
With eMule AI running, run the command:
`netstat -ano | findstr :63500`
to make sure that eMule AI is actually listening on port 63500

**Comment by Linderkin** [comment]
Found it - not a filter/guard/ban at all. It's a crash.

Went through everything you flagged (randomize listen port - already off, "any interface" - already selected, IP Guard and VPN Guard - both already disabled, confirmed via screenshots) with no change. Then turned on the Verbose log as you suggested and reconnected. This showed up at the exact moment of the hairpin probe attempt:

```
[ProcessPacket]: Client with IP=192.168.10.254 caused an exception, disconnecting client: Error no especificado
Error: 'Unhandled exception' while processing eDonkey packet: opcode=OP_HELLO size=33; IP=192.168.10.254
```

So eMule AI receives the OP_HELLO, throws an unhandled exception while parsing it, and disconnects the client as a result. That's the reset - not a filter, not a ban, not a protection rule. A crash in its HELLO parsing path. The IP shown (192.168.10.254) is presumably the router's address on the far side of the hairpin from the client's own perspective, consistent with everything else we've seen.

This lines up with everything we found: fails identically across all four probe_test.py variants (they'd all trigger the same parser bug regardless of tags), no filter/protection log ever caught it (nothing was actually filtering - it just died), and stock eMule works fine (different, presumably correct, parser).

Given it's a crash in a third-party fork's packet handling, not something on your end, I think this closes the loop - nothing left to chase on the ed2k-server side for the eMule AI case. Appreciate all the help getting the actual bug (frame-reading) fixed for real clients - that's working great now.

**Comment by andrey23127** [comment]
I made another small fix. Added tags to the hello packet: CT_NAME, CT_VERSION, CT_PORT An empty hello packet could cause a crash in emuleAI. The standard emule is resistant to this https://files.emule-security.org/ed2k-server

**Comment by Linderkin** [comment]
Confirmed - HighID with eMule AI now too, after the tag fix:

```
probe_identity: frame proto=0xC5 len=86 opcode=0x01 elapsed_us=2120
probe_identity: frame proto=0xE3 len=167 opcode=0x4C elapsed_us=2132
 INFO hairpin: client verified behind our own NAT → HighID lan_ip=<private_ip> public_ip=<public_ip> port=63500
```

So adding CT_NAME/CT_VERSION/CT_PORT sidesteps the eMule AI crash entirely - it was the empty/tagless hello specifically that its parser choked on, exactly as you suspected. Both clients verified working end to end now. Really appreciate all the back and forth on this - quite a rabbit hole for what started as "why can't anyone download my file", but it's fully working now. Thanks!
